Comment,Response
"Yup. Insane payments. Not sustainable. But the banks are all in","But what if they only give loans to unemployed people? That way, the banks wouldn't have any risk, since 6 x 0 is 0."
"Did the run out of water there yet?","IIRC they have in Cape Town"
"Thats the same thing?    \n  Edit: learned the difference","^ This guy doesn't get the joke."
"Originally it wasn't. I marked it using my secret mod powers.","Nice"
"Pembrolizumab is the single defining factor of Merck right now. The entirety of stock movement is based around this single immunotherapy.    \n  If pembrolizumab can consistently continue to show that it is a better PD-1 checkpoint inhibitor over competitors, which so far, it generally has managed to do, Merck will continue to do well.","Yea Keytruda is really important for them, but it's kind of disappointing that they don't have multiple irons in the fire currently."
"Chinese steel and aluminum manufacturers are directly subsidized by the Chinese government. They dump in the market and put American producers out of business. Then when the market is cornered they can dictate prices.","And? That just means cheaper products for me at the store. Why do I care if the chinese government wants to subsidize the things I buy?"
"Well no one had called his bullshit with a source so I felt like I had to","Did you even read your own link, your last in almost everything" 
"Halve*","Let me tell you about a thing called a maxed out credit card"
"Upvoted cuz girl","There's a reason it only shows its back side..."
"Says in the F1 form that they're working on an AI as well","god i can't wait for this buzzword to die. it's not an AI, its a god damn voice assistant for pressing 'go'on the playlist making algo."
"I was going to downvote you for refusing the reasonable request, but since you were impolite back, you get my upvote instead.   \n  \n faggot","that is better"
"'Remember that one time I was right guys???'   \n  \n -u/MrTrader1 as he's receiving his blanket from the homeless shelter","lol salty much? i warned you guys at 26.5k, DOW went to 23k, and now is at 25k, and somehow i lost money? [WSB isn't so good at math i guess](https://imgur.com/a/Ue9Ng)"
"Can\u2019t complain when the terminal is free for me as a student","only if you stay cooped up in the terminal room"
"The dividend would be 330% at that price   \n  Edit: that was really shitty math, I'm retarded","\\&gt; implying they'll keep their dividend"
"This is literally one of the first things you learn in a highschool econ class","You mean LIBRUL (((GLOBALIST))) PROPAGANDA?!"
"I'm worried about over buying of treasury bonds. That's why I don't want banks to be allowed to buy them. Banks are leveraged 10 to 1. Makes no fucking sense to me to buy them.","Look up how a dollar comes in to existence. That should help it make sense."
"1. Share frozen tendies right before he gets the chair   \n  \n 2. Wait for execution   \n  \n 3. Enjoy well cooked tendies","*jfc*"
"If I had gold I'd give it to you","your comment makes it worth it   \n  i shitpost as a means to get away from the soul crushing reality that exists   \n  that and my best friend who is also an autist is working far away for a while and i miss him some homo so i gotta channel that energy constructively sometimes   \n  as long as you read and at least partially remember we good   \n  have a nice day faggot"
"My target is always moon which i know is unreasonable. The thing is idk anything else besides the moon.     \n  \n Now wot?","let your dreams ruin you."
"A touch perhaps.","show me on the doll where wsb touched you"
"we already crashed, so...","That was a correction. A crash will hurt a lot more and XIV YOLOers won't be the only ones sucking dick for a sandwich."
"I'm fine with the first two","You are a pussy if you are scared of leverage."
"THEN SAY THAT YOU\u2019LL SELL MU AT 100 SO THAT IT\u2019LL PEAK AT 90","I'm going to sell MU at $100.  Hopeful target date of mid October of this year."
"I was up like $700 this morning on the stock and finished $333.71 down. Talk about feeling stupid.    \n  Edit... crap it was worse. It was a $1500 difference on the day. I need to learn to take gains right after earnings. Shit.","Same boat"
"I don't recall police trying hard to get convictions on Wire? They were after hardcore criminals.","Are you joking?  There were those two cops that they always followed who were supposed to represent the normal cops in the world. Make your busts, hit the corners, throw some teenagers and kids in jail, talk about getting respect. Herc and Ellis were often cops just after some convictions."
"fun fact faggo. gpus last over 68,000 hours each. read a fucking book.","&gt;gpus last over 68,000 hours each.   \n  7.76 years cool   \n  &gt;  read a fucking book.   \n  fuck that shit the fuck u think this is /r/books"
"My concern with spotify is that once the ipo hits and they double their value the artists are gonna see they are getting a raw deal and demand higher returns on streams of their music and/or the labels are going to start leveraging more for their content.","Spotify is losing half a billion yearly, it's not like the artists are getting ripped of."
"not amd vega","Can confirm I'm running at 60c and never reach above 65c on 6 Vegas   \n  The trick is to make your fans spin at 3500rpm so it sounds like you're in a factory"
"Lmao what kind of shit are you talking about with the police","https://www.youtube.com/watch?v=08fZQWjDVKE"
"A first investment..","50 bucks is a hand of blackjack, not an investment."
"economy is too good gotta keep testing the bottom bro","The fucking end is near. I'm not sure when but I'm going to sell everything right now and lock in this loss before I gain everything."
"What if your buying straight equities? Still hold off. Or buy and average down to 0?","Cash is a position. Sit on it. Don't play the volatility unless you wanna gamble.   \n  Wait for a reversal pattern. Or figure out a PT that you are happy with saying 'this is reasonable, I'll jump in now' ...You'll be fine on the sidelines instead of playing on the railroad track."
"Yeah that name was taken :(","at least you tried"
"Bitcoin dishonors family","FAMIREEEEEEEEE"
"Volatility is money, if not for you then for someone else","I don\u2019t day trade so I just think it\u2019s annoying. Makes my chart look like shit."
"'He (OP) eats a penis in his north house'","Woah now. I'd eat 5 dicks if I could have a house in every direction."
"Down 2.5 percent lol","now 3.5 lol"
"Then it\u2019s not a bubble. People just have the funds to buy expensive homes now.","Until a recession happens and the tech workers get laid off.   \n  Never gonna happen though, right?"
"&gt;so all white males are nazis?    \n  \n  According to the dumbass liberals in congress","im not sure thats what he was talking about   \n  ...its *too* stupid..."
"goin to hell along with the rest of the market","Shoulda bought cron my dude. Saving my ass today."
"25% tariffs on steel lol damn son","Holy shit. Did they say anything about lumber or dairy? asking for a friend..."
"haven't had 4 down days since aug   \n  bought FDs on SPY for tmw","Puts? What are you, un-American??"
"Oh come on, you and everyone else on this sub is a mega bull   \n  You\u2019re right, I don\u2019t think it will lead to a bear market but it definitely will slow things down","We also haven't seen full quarters of post reform earnings however. GDP is cruising but not insane and employment is great."
"this time in HD","Short home deport?"
"&gt; Long term   \n  what dis","What you live to see if you don't go long $ROPE."
"I bought puts based on that post from yesterday and it's paying off","\\&gt; thinking something specific is driving a single stock down on a general equities sell-off"
"G","o"
"I believe it worked for standard oil","[John McGee from the Journal of Law and Economics doesn't think so.](https://mises.org/library/100-years-myths-about-standard-oil)"
"i'm in CA and my landlord is in Brazil for three months, I think this is all just part of a real estate food chain","Been getting my CA real estate license just to prep for the meltdown"
"GE. Boeing. 28 others.","Why are you putting GE and Boeing in the same sentence."
"MU","Cow"
"Ha!  You think WSB can get anything useful done?  Of course not, too much autism here.  Maybe our brothers over at /r/investing can eliminate Thursdays for us.","They'll just tell you what you're doing is too risky and suggest you  invest in a Vanguard fund that inverses Thursdays."
"Can you live inside a stock?","amd headquarters, laughing stock"
"Faggot","Faggot."  
"You shouldnt be using multiple accounts, it is visible with RES","Lol who spends money on RES"
"Today I bought April 20 $90 calls.  Already had April 20 $95 and March 16 $92 from a last week.","Thanks, bought 87.5 @ April 20. Good luck !"
"Scalp 02 March 47.5 calls or nah?","Nah"
"I think we're all banned over there, I know I am.","I've never been there and I am"
"Wish I could eat air.","i identify as plantkin   \n  git gud person that can't scrub carbon dioxide from the air"
"Op is late obviously","If she late, probably not his"
"I have a mechanical pencil if that counts","Good enough"
"Can confirm I'm running at 60c and never reach above 65c on 6 Vegas   \n  The trick is to make your fans spin at 3500rpm so it sounds like you're in a factory","Ah so u got airplane engines in your house"
"10.9 :/","Good Lord"
"REV UP THOSE FRYERS.","https://www.youtube.com/watch?v=6TUa6KUVLoY"
"So, the question now is, do we inverse and start selling cash covered puts on HMNY&gt;","There's only the $2.50 strike below $5, the only ones worth selling are Jan '19 leaps with a bid at $0.60 and a $0.20 spread.  I wouldn't"
"Anus?","Urethra."
"This is what commission free options trading will turn people into. Scalping 4$ off trades. My god. Good thing hes probably insolvent after today from selling naked puts.","Chump change for my tendies! Thanks u/atworkrnnotdoingwork for the shout out, I'll see you all at the poor house bbz"
"Your balance says 14. There isnt a single currency in the world where that is impressive.","Nigga I literally doubled my $10 investment. It couldv easily been $100 or $1000 if I had that money."
"We get more steel from Canada and Mexico, actually.   \n  And they're threatening trade war.   \n    \n https://www.bloomberg.com/news/articles/2018-02-28/mexico-is-said-to-plan-retaliation-if-u-s-imposes-steel-tariffs   \n    \n  Pepper yer angus.","Wow I learned something new today. I need to find out where we get our Aluminum from considering we slapped a 15% Import Tax on that as well."
"[If the POTUS starts a trade war and slows down the economy, then we won't have to worry about interest rates now would we.](http://i0.kym-cdn.com/entries/icons/facebook/000/022/138/reece.jpg)","I can laugh at this because the only alternative is to weep."
"Wow thanks for this. My PA was 50k, plus margin of about 20-30k, so 15% loss roughly. Held REITs. See previous posts of mine. I need to just not check it for a week and see how that goes.","???Wants to buy and hold and check his portfolio once a week???   \n   ???Also uses margin???   \n  You belong here"
"How do you get a Tibetan monk certificate?","PayPal me $40 and I'll send you an official certification."
"I wouldn't describe our situation as an asset bubble","FREEE MONEY IS GONE"
"everything is obvious after it happens","He talked about tariffs during his campaign. Everyone said it was a bad idea back then."
"Short home deport?","Long ICE"
"Until a recession happens and the tech workers get laid off.   \n  Never gonna happen though, right?","Workers getting paid 200k aren't the ones who will be let go."
"....You really think the 1940s is comparable to now?","No. Our industrial powers is even worse now."
"Acually it is to those with jobs. And always blame Obama. Fucker bailed out so many, kissed so much ass, always pc. They guy might be the downfall of the US.","Everything you just said only confirms you\u2019re a fkkin hamster"
"Nevermind. They were green earliar. All 4s is definitely good luck though.","I thought so. Just needed confirmation."
"I think it's an overreaction too.. I mean it seems driven by an assumption that a trade war is going to start because of the steel tariffs. Maybe, but it's not a certainty.","Yeah, I feel like nothing will come of it with the trade wars. Also, JnJ has been down 10-11% since Jan 31st. Which obviously doesn't mean much, but I don't see it going much further. It did hit $125 on Feburary 8th though, so hopefully it doesn't go further than that. Lastly, its lost 6 months of gains at this point."
"My stops fucked me out of a 5 bagger today","ditto. but quick little moves are gonna be more consistent... ill take a few percent up a few times a day over getting fucked for 100%"
"X gon give it to ya   \n  \n \n","https://www.youtube.com/watch?v=1P0yfq2wDvU"
"Fuck this hits home","Literally..."
"I have 4 spxl April 20 options, strike $50 that I paid $5.03 each, how fucked am I?","Oh shit thats a high ass premium. Id say fucked, but you might be able to sell for 50-75% of original value. shouldved sold when spxl hit $49 a few days ago."
"i identify as plantkin   \n  git gud person that can't scrub carbon dioxide from the air","plankton? uh...plant..?what? I'm done for the day..."
"Woah now. I'd eat 5 dicks if I could have a house in every direction.","Directions are 4 (unless you want an house on the moon). Why 5 dicks for 4 directions? One extra for personal delight?"
"Probably an omelette for lunch.","Must be nice having $"
"You're stupid if you think recent news isn't effecting the market in the mid-term, if not long. Buy SDS if anything, next week will continue the shitshow.","You had me at \u201cyou\u2019re stupid\u201d"
"No I get that. The thing is I don't fully understand the mechanics of options: IV, strike, ITM, OTM. I don't understand the payouts or how to assess the value of a contract. Because I don't have a complete understanding of the product I can
"Waste of money.  I went to an in-state party school and could have seen the effects of this action.","Yeah but you don't have the power to stop it.  Trump the Ivy League school graduate does"
"Or fuck that margin and by LEAPs and create a poor mans covered call. Spread them around and should be good to go.    \n  \n If you are hard long, buy the stocks. If you would have a stop loss at say 10% of what you would pay. Take that 10% amount and go buy a LEAP. Write calls on the LEAP and bring in some income while minimizing the drawdown and not doing margin.","are you able to just write a call for every leap contract you hold? does it have to be the same strike and exp or is the different what you pay/get paid like a spread?"
"Welltower is great. I'm losing alot of money with it atm. Bagholding for about 3 months now","I'll check it out, though that's more service properties.  I'm looking for family housing funds specifically"
"F","F"
"I lost basically the equivalent of 2 years of my money being in an Ally savings account before the market even opens and you're telling me this isn't a crash?","You're seriously on WSB comparing returns to an Ally savings account?  Go back to r/investing"
"I'm breaking records with all this news that keeps coming out. I'd like our 'days since last incident' get past 2 for once.","But then I would shit my pants!"
"$SQ duh","Hell yeh"
"We survived Obama's tariffs on chinese imports, we'll survive this president's china tariffs, and we'll survive the next president's tariffs.","Last time tariffs got put on steel there was a 10 month recession in the industry. That was under GW in 2002."
"Can you hold people liable for influencing the market?","Depends if they can pay for a better lawyer than you."
"I'm hoping the market panics up","Dilly dilly!"
"Penis.","some homo"
"So I could be a double good investing person?","i only invest while sucking dick   \n  and i only trade on leverage equal to the number of dudes that have been in my asshole in the last 24 hours   \n  im up to 15x   \n  ive been up about 150% in the last 3 days   \n  what can i say it takes a bottom to see a bottom"
"Do you smell burning toast?","I get this reference."
"You can\u2019t expect a retarded person to know how to read","you would if you were retarded"
"The main question is will Trump continue to advocate for trade wars?","So long as there\u2019s Twitter he will"
"Obama *was* decided responsible for the stock market not a month ago","Unfortunately for us all, that no longer seems to be the case anymore. This pullback is directly related to Trump's comments. The market is his now."
"Soon we'll be eating shoes out of necessity instead of just losing bets","boot soup goes great with rat tails"
"the /r/personalfinance is more like just jerking off at home","&gt; jerking off at home   \n  That's the emergency fund."
"He's too retarded, even for WSB.","never say never   \n  we ll probably find someone that is gonna buy spotify on day 1 then sell day 30"
"Can i pay on margin?","Yeah, idgaf where you get the money from."
"Fucking weak handed little bitch, should've held onto the troll bag until the very end   \n  No wonder you don't trade options","Shit. :("
"You've done it again jelly boi","Just wait, it will drive right up.. it could take a little, but it will."
"I just hope pence is a good rebound before we settle down for whatever unfuckable, emotional, but ultimately safe choice the democrats give us in 2020.   \n    \n  Sure, we'll go back to recycling and eating healthy. But in the back of our minds we'll always remember that one time we stuck our dick in crazy","&gt; unfuckable   \n  Are... are you saying youd have sex with the obese 70+ year old that is trump?"
"Tomorrow you will lose money   \n  t. future","Its happening! But 90% of todays loss is from $WSR."
"In a grave, u/jonloovox is into necrophilia.","Giggity"
"Knowing the demographics here, they'll lose money both ways instead of one way..","It would trade at 41 and 53 at the same time so op loses twice the premia"
"Good DD","LOL i feel bad for the guy but that aint stopping me from buying a bigmac."
"/r/CringeAnarchy","/r/kappa"
"I said since the election that I'm down for tax reform and the wall but protectionism is a terrible idea.  That and the fact that he's clearly unhinged meant I couldn't vote for him.","Clearly unhinged? Have you seen the electoral map? Are 45 states just full of stupid people?"
"than*   \n  But you\u2019re trading CVS so we knew you\u2019re autistic anyway","That be how u know i belong here with my WSB bros ;)   \n  Choo Choo $$$$"
"BRK has over 130b in cash right now, second only to AAPL","Nice, thanks for adding"
"Quick, panic sell your kidney for cash.","Uuuuuuuuugh"
"Usually people who go to Wharton don\u2019t advocate for trade wars","not unless he was short everything"
"That was last month. This month we get to \u201ccelebrate\u201d women\u2019s history","Long $SHE"
"Liberals in Oregon already passed that law here.","Are you saying it has bi-partisan support?"
"I forgive the Japanese. They gave me Dragon Ball Z, yu yu hakusho, berserk, and one piece. Plus sushi. They are  some of the greatest people on the planet. I will long the Japanese people forever.","Don't forget hentai"
"That's realistically the right move, but im still in the hoping stage of denial.","Looks like we're recovering, still did well on my 2 year short though so I'm content."
"I haven\u2019t even considered how China would happily gobble up SA\u2019s mineral wealth.  Especially as China would just maintain the corrupt system by paying a few top politicians, and enforcing security by bringing in its military, as it does.","Yup, they will also start to colonize and expand their empire just as America did. The number corruption of the Chinese will allow them to destroy us economically but right now they are just building their wealth.   \n  Where do you buy land? Where it's expensive or cheap?"
"They'll turn on him depending on how the midterms go.","Dude I studied all night but did okay. Gotta work hard for the final. Thanks for asking though."
"When hyperinflation kicks in, we will all be millionaires.","i could live w that.... pay off mortgage, or buy a pack of gum... meh, I'll take the gum please"
"???   \n Lower taxes = higher corporate profits = higher stock prices.    \n Lower bond prices = higher interest rates = higher costs for businesses to borrow = lower stock prices","Nah dude nothing works like you want it to. Why do you think $SNAP has been going up. Geezus this thread doesn't know sarcasm"
"Actually, I can't. The article i found hosting about Donald Trump supporting gun registration is just... gone.","They do that a lot. When Cohen publicly admitted he paid Stormy Daniels, the article was up for a couple hours (people still commented 'I smell bullshit'), disappeared, and nothing else ever came up. They censor even true events."
"And low returns and getting ass fucked for going long on beef futures during lint.","Here come the gainz!!    \n  Except for my MCD boys. They're being smite'd today. Don't know why. They offer the fish fillet option for us catholics. That should be enough."
"Aaaaannnd is a real sub with almost half a million subscribers. Of course,  of course it is.  Ahhhhhh, reddit.","Really,  this is offensive? You bunch of pussies are worse than  a bunch of matriculating liberal arts radical feminists."
"It's a retarded direction to be going in the first place though. 'Oh look the thing he did was slightly less shitty than the thing he said he was gonna do' doesn't make you a master negotiator.","It *might* when you're in an abusive relationship.    \n  *My bruises aren't as bad this time! Look! Progress!*   \n  or in wsb fashion   \n  *I've only lost 96% of my portfolio in 6 months! Look! Progress!*"
"NA, just feel like loosing all my tendies today","&gt;loosing    \n  *Be free!*"
"i wish i'd have panic sold everything a month ago.","welcome home"
"Give it time lmao. Go read a Tony Robbins or Warren buffet book and get some backbone","i just read wsb and then remember that most of us are like people from /r/wheredidthesodago"
"Oh hahaha my bad but I'm genuinely curious as to what lead to this crash. I'm not good at economics, nor it's policies.","imported steel tariffs announced this week by Trump seems to be the biggest factor   \n  t. also not an economist"
"tomorrow is Saturday fag","you right, thanks fag"
"How'd I vote? Well naturally I called in to tell them that the proposed incentive plan of him getting paid only if stock price  increases is is not acceptable. I told them we need to implement a guaranteed payment of at least 1 billion a year and a golden parachute package if the venture fails.","So, nay?"
"Isn\u2019t this r/autism though?","nah its actually r/Cuckold/"
"Enjoy your grenade attacks   \n  Edit: Three so far this year. You guys should pass some sort of grenade control laws or something.    \n  https://en.wikipedia.org/wiki/List_of_grenade_attacks_in_Sweden?wprov=sfla1","Enjoy ya dead school children. Muppet"
"Yeah but you don't have the power to stop it.  Trump the Ivy League school graduate does","A monkey with the ability to type on a keyboard and access to a fake Trump Twitter account could stop this. The only difference between the monkey and Trump is the monkey wouldn't have made such preposterous statements but instead would have spent the time throwing literal shit at others."
"Look likes cock is on the menu again, boys.","&gt; Look likes cock is on the menu again, boys.    \n  i was wondering why it was so cheap   \n  [i cum three guys before noon](https://youtu.be/4xX1pMn8LvA?t=6m27s)"
"G","U"
"I did the same thing, except i didn't believe in myself and started reading all sorts of shit here about puts and how bad it looked. so i took a 900 buck loss right before this massive rally.","Gotta believe in yourself"
"SHOP has been stupidly resilient through the whole last month given they have no real earnings or anything","I picked up calls after the offering and sold them today for 30% gain"
"might be good for a short play into earnings but i wouldn't want to hold through earnings... mild winter for CO, UT and CA","Well I\u2019m certainly not selling for a loss."
"I BELIEVE THAT SHE WILL WIN","Here\u2019s how Bernie can still win"
"Panic is over boys, i bought some spy put FDs, moon inbound","We r muun bound"
"He expected a passive fund to try to time the market. When I asked if he read the prospectus he said he didn't know what that was. \n  \n 50% chance it's a troll, 100% chance it's retarded, based on post history.","It's the second one."
"Assuming it recovers in the time frame you remain liquid","People held AMD and RAD so I'm prepared not to off myself."
"But you get four with 20 and that's the perfect amount","This is correct.  No wonder MCD was up.  They have been shorting OP sauces for his entire life."
"Thanks, I'll just see myself out","And stay out!!!"
"No, you guys are idiots if you can't see how obviously smart this move is.  If you have a trade deficit, you're losing money. Stop trading and you stop losing money. It's fuckin simple.","&gt; Stop trading and you stop losing money. \n  \n Is this real life?"
https://imgur.com/gallery/w4sojxe,"Why do you fucking assholes post a gallery of one. It's like calling your single share of MU a portfolio."
"Obama, like Bush and now Trump, pandered to the steel industry with tariffs. The nuance of one vs another is unimportant, especially if you're not interested in advocating one or the other.","&gt; The nuance of one vs another is unimportant \n  \n Absolute nonsense. A targeted tariff against one product from one country, with a history of shady trade practices, is not even close to the same thing as slapping a blanket tariff on products from key allies and trading partners."
