Comment,Response
"&gt; Hungarian collectible trading cards \n  \n Aw man, I just snapped up all these cheap MTG cards...","I'm pretty into MTG and I swear they are a better investment than stocks in many cases."
"How much are you up in the past 6 months?","who said I was up?"
"Shout out to my man in the comments with that r/quityourbullshit reply","Mr_Trader1"
"Read Security Analysis, and study it. Then learn options.","Murphy's book?"
"Nah dude nothing works like you want it to. Why do you think $SNAP has been going up. Geezus this thread doesn't know sarcasm","Lol my b. Was drunk and my financial side came out"
"and that's us saying that","so that's saying something"
"A few years back, there was a time when the market cap of BBRY (now BB) went under the book value of the cash on hand that the company had. Just imagine that. I no longer trust that book value is ever the bottom of the stock price and I'm writing this as a warning to you.","The market can be irrational something something panic sell."
"Agreed. I think it should include Fox though. Even though those guys are asses it would add to this bot's credibility as one trying to capture the story from every point of view.","No. There are plenty of conservative newspapers (Wall Street Journal, The Hill, The Chicago Tribune, The Economist) that actually publish retractions when they make mistakes. Fox just deletes the story and pretends it never happened."
"just in the pants","How European models are you fucking these days?"
welcome home,"In another month i'll still be saying the same thing."
"Key here is so far.","prescient"
"Even if its another 2008 scenario it will rebound...right? RIGHT GUYS?? HELLO?? REEE","Yeah, keep buying all the way to the bottom. You just need lots of cash on hand.  \n  \n Edit: I'd like for it to be clear that I'm talking about indexes and not individual stocks. You shouldn't buy Enron on its way down"
"They do that a lot. When Cohen publicly admitted he paid Stormy Daniels, the article was up for a couple hours (people still commented 'I smell bullshit'), disappeared, and nothing else ever came up. They censor even true events.","But i thought those maga peeps were all bout m'free speech and no censorship??"
"No, you're thinking of seraphs. Tariffs are a type of old card commonly used in fortune telling.","No, you're thinking of Tarot. Tariffs are a slight projection from the end of letters in certain typefaces."
"That's what I said, dude","So two idiots that emphatically bitch about people who bitch don't even realize they're saying the same shit...and it's patently false. Either the worst trolls or the dumbest our race has to offer."
"The Donald has 579,602 retards and Late Stage Capitalism has 260,397 retards so The Donald has 2.23x more retards.","Underrated comment"
"You need to be cautious about your tax consequences going forward. For example I had 500 shares of $AAPL that I scooped up in 2000ish and my calls say get 'called' I would have to realize the capital gains in that year.. So use your retirement account :)","Good advice. Thank you. I don't think I can open a retirement account until I'm 21, so I will keep that in mind."
"Jokes on you I've already hung myself","hanged*"
"sell everything \n  \n including plasma and butthole access","Full access or just the tip?" 
"boot soup goes great with rat tails","I'm going long on rat and squirrel."
"&gt;loosing  \n  \n *Be free!*","release the tendies!"
"Here's how Bernie can still win","Here's how hard those tendies hit the floor"
"Tl;dr South Africa is trying as hard as it can to become the new Zimbabwe","Amazing how little coverage that is getting."
"Not being dumb.","but it often seems like 'dumb' is exactly the sort of word one might use to describe the sorts of plays we see them posting here. it's just like, betting the house on black.  \n  \n i guess the smart ones are just lurkers until they lose money."
"just sold me on options trading","It's fun and you'll definitely get hooked. I've only traded options for about 2 years now and I don't even want to fuck with regular stocks any more" 
"This honestly seems like a half decent idea except for the fact this is shameless self promotion. Change your username, you will be far better off advertising here.","Thank you for complimenting the idea.   At the moment, it is our policy to only post under our company name."
"did you honestly expect anything different from wsb \n  \n this sub is missing a handful of chromosomes on average and half of us arent toilet trained","i thought we had extra ones?"
"Mmm, yes, bond performance has been stellar this year.","I mean like short them or whatever, idk man I just know higher yields = shittier stocks"
"Still lost money on MU though","My expiry date is in 2030. I'm still optimistic."
"I check every hour because I get a dopamine rush when I see all green. When I see red my adrenaline levels boost and I reeeee.","LONG on REEE"
"Are they buying more companies? What are they doing with all the cash?","Expanding capacity and establishing a low-cost, global production footprint.  \n  \n They cite Cronos Isreal, a joint venture with Israeli agricultural collective settlement Gan Shmuel ('Gan Shmuel') to produce and distribute medical cannabis in Israel as an example."
"Bought my first contract today, $SPX 3/16 $2700 CALL BABY. We're going to rebound right back up, trust my beginners luck. Options are pretty simple, just read some shit then buy one and observe it. My understanding of them has doubled today after buying my first one.","Stock market crash confirmed."
"He's become self aware","I think he thinks Autistic means Stupid. His dad would know if he was Autistic."
"\\&gt;No risk no reward \n  \n \\&gt;Risk but still no reward","Risk&gt;Reward"
"Now go to the basement, wear the goat mask and be ready on all fours when I come down","And quit neighing like your mother, she wears the horse mask you wear the goat one- get it straight!"
"He doesnt prescribe to Julius and Augusts' bullshit","We only fuck with the Greeks. Hail Sepocrates"
"down 10k on a 200k INHERITANCE and supposedly 'can't afford to lose any more'  \n  \n fucking lmao. only down 5% anyway... and then he thinks that his banks savings account would have been up 1% in a month. i just... wow. and then after all that, while things are down, he is encouraging everybody to sell the dip. i can't fucking believe this is real. why do people like this get to inherit nearly a quarter of a million dollars, and I'm over hear with student loans?","Your family sucks at life 🤷‍♂️"
"The MoviePass is at least 1B","Agree bought more long calls today"
"Thanks, I wasn't expecting the trade war to start. BA get's hit twice, on aluminium and China buys all its planes from Airbus. But hey I still got a week maybe DJT will start a war or something.","I'm long BA and having a hard time accepting  their recent performance.. but there is valid reason for concern. Next week will be another blood bath. Stop loss at 330"
"&gt; Look likes cock is on the menu again, boys.  \n  \n i was wondering why it was so cheap \n  \n [i cum three guys before noon](https://youtu.be/4xX1pMn8LvA?t=6m27s)","What the fuck was that? I couldn't stop watching that autistic shit"
"Wb what i said below about buying dips of companies that get bad news coverage, like when intel got the bad rap for backdoors in chips, sent down 4 % before earnings then shot 10% after. Should i be buying those opportunities ?","Good companies that will almost always recover - sure buy the dip (e.g. coca-cola, etc.). You can also do this with index funds, like SPY. Averaging down is actually a pretty good strategy for index funds, as they'll over a long enough timeline always grow. \n  \n Almost any other company DO NOT buy the dip just because of bad news coverage thinking they'll automatically go up. Take a look at enron."
"There probably is because then America is one heart attack away from a 3 term president","Nope 22nd amendment actually stipulates very clearly that it prohibits the election of a candidate for the 3rd time. \n  \n Edit (for clarity): It prohibits the *election* of a candidate for the 3rd time not the actual 'holding the office' for a 3rd time. Hence there isn't a clause preventing a former president serving as VP, thus becoming president in the heart attack scenario mentioned above."
"mutha fucka are those YOUR OPTIONS?!?! THERE IS ONLY 10 CONTRACTS IN VOLUME!","Thats literally perfect for you then. $150 extra finger-bang money. And I expect more to get released. \n  \n You did notice the ask wasn't $0.85 yet either right? \n  \n I may pick up some 290s and 295s monday. I used to own them, sold my 290s at mucho deneros in January"
"Fill me in?","Netflix show"
"I still don't get it","You need to let me let you help you."
"BMW still exports cars to America.","BMW builds more cars in the USA than it sells there. Sure there is some importing and exporting due to different models, but it's still retarded."
"I don't know why you're so pissed, just enjoy the newest season of the Apprentice like the rest of us.","Can anyone get me a copy of the apprentice?  It is gone! One season is available on DVD and even bit torrent doesn't seed it there must be something in it he really doesn't want us to remember."
Fuuuuuuuuuuuuuuck,"Fuuuckkk that ffuuuckkking fucker."
"No such ticker exists. The shirt is a lie!","I dont care if they sold deep sea fishing lures .....people would buy $wag just to have it."
"Unethical Life Pro Tip: \n  \n 1. Become the leader of a country  \n 2. Buy massive shorts  \n 3. Bash companies and cause volatility in the market  \n 4. Profit","Step 5. Watch as your kids are sent to jail."
"Brought some on Thursday couldn't sell it on Friday or lease I be declared a day trader and banded.  So I figured I need to hold it a few days.  Fuck Friday was painful watch we end green on Monday!","&gt;Brought some on Thursday couldn't sell it on Friday or lease I be declared a day trader \n  \n I don't think that's how it works."
Y tho,"Cuz it's growing"
"&gt;Thinking of your positions in terms of share price and not % of account \n  \n Spoken like a true robinood user","Bro Brk is sooo expensive bro. Look at snap. Way cheaper therefore safer bro"
"Seriously when the fuck is canada getting robinhood this is so ridiculous","When your government stops screwing us on trade deals"
"Then apply tariff to them... The thing is, everybody is playing for their own team, that is ok as long as it is done under certain rules and with certain context. For example EU applying anti-dumping charges against China didn't create any drama - just normal business as Chinease themselves know that they are guilty as hell of dumping.","We have been at economic war for decades. The way I see it, just business as usual. \n  \n https://infogalactic.com/info/Chicken_tax "
everyone on reddit is in it,"There's a lot of poor fuckers on reddur too, just head over to any of the socialism subs"
"Yep, it used to be called a margin telegram.","Ah yes the margin letter"
"Where is the jpeg asshole","You mean asshole.jpeg?"
"Shit really? I'm from europe so I don't really know anything about soros. But damn. nflx can go to hell anyway, i sold that shit when it was 280..","Don't just take some fucking idiots word for something on the internet"
"*3 years later* shit man it was regular wars I was thinking about my bad","Who knew trade wars could be so complicated?"
"Gonna have to write that one in my friend","ITS NOT TOO LATE"
"We only fuck with the Greeks. Hail Sepocrates","Hail Herpes"
"I'm aware. But I'm saying if both happen Tesla will still suffer","Ol' Musky might relocate to EU. Can you imagine the faggotry that would follow?"
"Ok we've always been the side with leverage. \n  \n Why has it never worked ?","Because we never had a president with Balls as big as Michael Obama's."
"Thanks for the reply. It seems like a surprisingly wide loophole. \n  \n 1) Set leverage ratio \n  \n 2) Have arms length associates sell options. \n  \n 3) Lower ratio \n  \n 4) ???? \n  \n 5) Profit! \n  \n How did a robust options market exist if this was regarded as a real possibility?","I don't know enough to say; but if too many adjustments happened you can imagine that people would stop buying."
"You dropped a zero. It's supposed to be 1500%.","Hahahaha lol, you're so retarded, a '0' doesn't make a difference because it's literally 'zero'! \n  \n 15 is the same as 1500000000"
"Youre two hours late tho cuck.   \n https://www.reddit.com/r/wallstreetbets/comments/81svfi/just_a_couple_more_till_i_get_my_yacht/","I apologize for this, but the reddit gods have chosen me. 2 hours or not I'm the rightful heir to the iron throne"
"This whole sub is pretty much satire","It's refreshingly good at it too."
"You're gay one here. SJWs are known cucked faggots.","Your probably Russian in which case you are just being a patriot for your country and who am I to stop you. But just in case you are actually a fellow American, fuck you treasonous bitch."
"I don't think people in the market for Teslas are really concerned about the price of the car","People in the market for 35 - 50k car price (model 3) are concerned about the price of the car . Chances are their interest rate will continue to go up now you can factor in aluminum price rise . To top it off you will see retaliation and since Trump is deciding to attack every country at once they will probably just create joint tariffs back for the sake of their ' National security ' ."
"Yes but to get to it you need to go to NOLA. \n  \n I dont think the same standard applies to the rest of the city","Thins the herd a bit"
"Also don't short SNAP, because apparently losing millions of dollars and making your product shitty and unusable is the secret to stock market invincibility.","Yeah fuck that noise, I'm staying away from that artificially propped up piece of shit. Can't believe it was up $1.17 from the low on Friday. Why!? Meanwhile my profitable oil companies in a market where oil prices have gone and are continuing to go up are all down considerably."
"Not when you day trade straight up stock and or futures!.. It either goes up or down and you sell that same day..  Screw Options and their volatility.  \n  \n I play futures.. They rise and fall every day with no day-trading rules and no implied volatility bullcrap... \n\n","and you cut your portfolio more then in half by your own admission trading them. Why do you continue advocating trades/trading methods that arent even successful for you? Its funny that the way you word your advice makes it sound like its working for you. Maybe add a footnote to your posts *btw i cut my portfolio in half by doing this, and you can too!"
"you're even more retarded than op. congrats","No shit, that's why I hang out here."
and that.,"I'm pretty good at this investing thing... what are the rules again?"
"2 legit","2 legit 2 quit."
"C'mon. I know that obvs happens but given Trump's autism and cronyism, this is at least plausible if not probable.","'two officials said.'. This is called an anonymous source, which a news agency uses when they can't confirm the truth or not.  It's a fucking sideshow."
"Don't worry...they won't lend you that $1,000 to YOLO on $AMD","I just had a vision of measuring school children for trading aptitude and then putting the best in a school like in enders game."
"The european carmakers would just use the opportunity to have the EU impose huge tariffs on US cars as well.","There already are huge tariffs on US cars."
"Not a RH as I actually have options.  I may have been slightly confused as I have never actually hit that restriction (a man needs to know his limitations).  Everything I say is a lie. Except for that and that...","I have RH and options? What's your point? Still losing money the same"
"You must be fun at the parties you don't get invited to","oh shit cake fight"
"Cut taxes during one of the greatest markets in US history. Makes sense /s","For real, if we crash with in the next year it won't be good because you can't drop the rate that much"
"Yes but delete this","How do I delete other people's post"
"Fuck BNJ, those socialist faggots.  Hope they die a horrible death","Socialist? Care to explain?"
"Sell it all like, tomorrow or like the day before earnings? I bought it in anticipation that it would run up to earnings but I didn't expect it to close in on 50 so far ahead. Now it seems like it has to pull back before then but if it has just pulled back before earnings I think there is a much higher chance of a pop.","It doesn't have to pull back, but it might and it might sit in the low to mid $40's.  selling the appreciated options and buying January's gives you plenty of time."
"Dear god no","hard liquor comes in glass \n  \n time to start buying liver transplant futures"
"Plus don't forget trade wars are good, and easy to win","stable genius move by trump right there \n  \n ^^^^^/s"
"Murphy's Law \\+ Trump's weekend tweets on tariffs, and I'm about to go green for the first time since Black Friday, the universe can't allow that to happen.","&gt; the universe can't allow that to happen. \n  \n youre goddamn right"
F,"A"
"I only have like 200 shares so I'm just holding it because why not. It could be the next NVDA for all we know.","Well we do know, because actually it turns out NVDA was the next NVDA"
"You're probably right. IMO it may make sense to wait for a lower VIX. Institutions still playing short VIX, and this being more of a medium to long term thesis, makes sense to wait for a good entry point.","Shorting the VIX is stupid. It's still a great time to long the VIX right now. Hedge your losses..."
"Whoa whoa whoa, I thought everybody was gay here. His 'wife' is a dude, right?","He can be whatever the fuck you want for a $20"
"This is probably the right answer. I've said it before and I'll say it again, someone needs to suspend his fucking Twitter account lol.","TWTR will go bankrupt if they ban Trump again"